{"$schema":"https://json-schema.org/draft/2020-12/schema","title":"Карта одного дела V1.1. Заполняет LLM, не сотрудник.","type":"object","properties":{"act_type":{"type":"string","enum":["simplified_written_decision","other","unknown"]},"data":{"type":"object","properties":{"court_name":{"type":["string","null"]},"court_address":{"type":["string","null"]},"court_instrumental":{"type":["string","null"]},"court_genitive":{"type":["string","null"]},"case_number":{"type":["string","null"]},"decision_date":{"type":["string","null"],"pattern":"^[0-9]{4}-[0-9]{2}-[0-9]{2}$"},"awareness_date":{"type":["string","null"],"pattern":"^[0-9]{4}-[0-9]{2}-[0-9]{2}$","description":"Только для внутренней проверки хронологии. НИКОГДА не вставляется в ручные поля уведомления."},"filing_date":{"type":["string","null"],"pattern":"^[0-9]{4}-[0-9]{2}-[0-9]{2}$"},"plaintiff_name":{"type":["string","null"]},"plaintiff_genitive":{"type":["string","null"]},"plaintiff_iin":{"type":["string","null"],"pattern":"^[0-9]{12}$"},"plaintiff_bin":{"type":["string","null"],"pattern":"^[0-9]{12}$"},"plaintiff_address":{"type":["string","null"]},"defendant_name":{"type":["string","null"]},"defendant_dative":{"type":["string","null"]},"defendant_iin":{"type":["string","null"],"pattern":"^[0-9]{12}$"},"defendant_address":{"type":["string","null"]},"defendant_phone":{"type":["string","null"]},"defendant_email":{"type":["string","null"]},"amount":{"type":["string","null"]},"amount_words":{"type":["string","null"]},"legal_force_date":{"type":["string","null"],"pattern":"^[0-9]{4}-[0-9]{2}-[0-9]{2}$","description":"Дата вступления в силу. Не дата вынесения. В эталонах нет слота; хранится только в локальном отчете."}},"additionalProperties":false},"sources":{"type":"object","additionalProperties":{"type":"string"}},"facts":{"type":"object","properties":{"not_properly_notified":{"enum":["confirmed","unknown","contradicted"]},"did_not_receive_claim":{"enum":["confirmed","unknown","contradicted"]},"could_not_present_objections":{"enum":["confirmed","unknown","contradicted"]},"learned_from_bailiff":{"enum":["confirmed","unknown","contradicted"]},"will_provide_relevant_evidence":{"enum":["confirmed","unknown","contradicted"]},"missed_deadline":{"enum":["confirmed","unknown","contradicted"]}},"additionalProperties":false},"uncertain_fields":{"type":"array","items":{"type":"string","enum":["court_name","court_address","court_instrumental","court_genitive","case_number","decision_date","awareness_date","filing_date","plaintiff_name","plaintiff_genitive","plaintiff_iin","plaintiff_bin","plaintiff_address","defendant_name","defendant_dative","defendant_iin","defendant_address","defendant_phone","defendant_email","amount","amount_words","legal_force_date"]}},"conflicted_fields":{"type":"array","items":{"type":"string","enum":["court_name","court_address","court_instrumental","court_genitive","case_number","decision_date","awareness_date","filing_date","plaintiff_name","plaintiff_genitive","plaintiff_iin","plaintiff_bin","plaintiff_address","defendant_name","defendant_dative","defendant_iin","defendant_address","defendant_phone","defendant_email","amount","amount_words","legal_force_date"]}},"decision_copy_attached":{"type":["boolean","null"]},"evidence_attached":{"type":["boolean","null"]},"synthetic":{"type":"boolean"},"source_text":{"type":"string","maxLength":2000000,"description":"Дословный извлеченный текст одного выбранного акта; даты читаются только по явным ролям. Не объединять разные дела."}},"additionalProperties":false}
