{
  "synthetic": true,
  "act_type": "simplified_written_decision",
  "data": {
    "court_name": "Учебный районный суд города Тестова",
    "court_address": "г. Тестов, ул. Учебная, 1",
    "court_instrumental": "Учебным районным судом города Тестова",
    "court_genitive": "Учебного районного суда города Тестова",
    "case_number": "ТЕСТ-0000-26-2/0001",
    "decision_date": "2026-09-01",
    "awareness_date": "2026-09-15",
    "filing_date": "2026-09-22",
    "plaintiff_name": "Примеров Пример Примерович",
    "plaintiff_genitive": "Примерова Примера Примеровича",
    "plaintiff_iin": "000000000002",
    "plaintiff_address": "г. Тестов, ул. Примерная, 2",
    "defendant_name": "Тестов Тест Тестович",
    "defendant_dative": "Тестову Тесту Тестовичу",
    "defendant_iin": "000000000001",
    "defendant_address": "г. Тестов, ул. Примерная, 3",
    "defendant_phone": "+7 000 000 00 00",
    "defendant_email": "example@example.invalid",
    "amount": "150 000",
    "amount_words": "сто пятьдесят тысяч"
  },
  "facts": {
    "not_properly_notified": "confirmed",
    "did_not_receive_claim": "confirmed",
    "could_not_present_objections": "confirmed",
    "learned_from_bailiff": "confirmed",
    "will_provide_relevant_evidence": "confirmed",
    "missed_deadline": "confirmed"
  },
  "sources": {
    "court_name": "СИНТЕТИЧЕСКИЙ ТЕСТ. Не относится к реальному делу.",
    "court_address": "СИНТЕТИЧЕСКИЙ ТЕСТ. Не относится к реальному делу.",
    "court_instrumental": "СИНТЕТИЧЕСКИЙ ТЕСТ. Не относится к реальному делу.",
    "court_genitive": "СИНТЕТИЧЕСКИЙ ТЕСТ. Не относится к реальному делу.",
    "case_number": "СИНТЕТИЧЕСКИЙ ТЕСТ. Не относится к реальному делу.",
    "decision_date": "СИНТЕТИЧЕСКИЙ ТЕСТ. Не относится к реальному делу.",
    "awareness_date": "СИНТЕТИЧЕСКИЙ ТЕСТ. Не относится к реальному делу.",
    "filing_date": "СИНТЕТИЧЕСКИЙ ТЕСТ. Не относится к реальному делу.",
    "plaintiff_name": "СИНТЕТИЧЕСКИЙ ТЕСТ. Не относится к реальному делу.",
    "plaintiff_genitive": "СИНТЕТИЧЕСКИЙ ТЕСТ. Не относится к реальному делу.",
    "plaintiff_iin": "СИНТЕТИЧЕСКИЙ ТЕСТ. Не относится к реальному делу.",
    "plaintiff_address": "СИНТЕТИЧЕСКИЙ ТЕСТ. Не относится к реальному делу.",
    "defendant_name": "СИНТЕТИЧЕСКИЙ ТЕСТ. Не относится к реальному делу.",
    "defendant_dative": "СИНТЕТИЧЕСКИЙ ТЕСТ. Не относится к реальному делу.",
    "defendant_iin": "СИНТЕТИЧЕСКИЙ ТЕСТ. Не относится к реальному делу.",
    "defendant_address": "СИНТЕТИЧЕСКИЙ ТЕСТ. Не относится к реальному делу.",
    "defendant_phone": "СИНТЕТИЧЕСКИЙ ТЕСТ. Не относится к реальному делу.",
    "defendant_email": "СИНТЕТИЧЕСКИЙ ТЕСТ. Не относится к реальному делу.",
    "amount": "СИНТЕТИЧЕСКИЙ ТЕСТ. Не относится к реальному делу.",
    "amount_words": "СИНТЕТИЧЕСКИЙ ТЕСТ. Не относится к реальному делу.",
    "facts.not_properly_notified": "СИНТЕТИЧЕСКИЙ ТЕСТ. Не подтверждение по делу.",
    "facts.did_not_receive_claim": "СИНТЕТИЧЕСКИЙ ТЕСТ. Не подтверждение по делу.",
    "facts.could_not_present_objections": "СИНТЕТИЧЕСКИЙ ТЕСТ. Не подтверждение по делу.",
    "facts.learned_from_bailiff": "СИНТЕТИЧЕСКИЙ ТЕСТ. Не подтверждение по делу.",
    "facts.will_provide_relevant_evidence": "СИНТЕТИЧЕСКИЙ ТЕСТ. Не подтверждение по делу.",
    "facts.missed_deadline": "СИНТЕТИЧЕСКИЙ ТЕСТ. Не подтверждение по делу."
  },
  "evidence_attached": true,
  "decision_copy_attached": true,
  "uncertain_fields": [],
  "conflicted_fields": []
}
